{"skill_used":null,"decision":"hold","actions":["Keep channels.slack.streaming set to \"partial\" for now.","Check the authoritative schema and documentation for the exact installed version to determine whether the field accepts an enum string, a boolean, or both.","Validate the proposed configuration with the product's read-only config validator or dry-run mechanism before deployment.","If boolean true is confirmed valid, test it in a non-production environment and verify streaming behavior before a staged rollout with a rollback plan."],"blocked_actions":["Do not replace \"partial\" with true based only on hearsay.","Do not restart, reload, deploy, or otherwise apply configuration changes until the type and semantic differences are verified."],"evidence":["No authoritative schema or version information was provided.","The values \"partial\" and true may represent different streaming modes, so changing the type could alter behavior even if both are syntactically accepted."],"response":"Hold the change. Verify the version-specific schema and semantics first, then validate and test the boolean value non-operationally before any staged rollout."}