{"skill_used":"gateway-runtime-safety","decision":"hold","actions":["Keep channels.slack.streaming=\"partial\" unchanged for now.","In an approved maintenance workflow, inspect channels.slack.streaming with gateway config.schema.lookup and confirm the installed OpenClaw version.","Read the current relevant subtree with gateway config.get.","Only if the schema requires boolean true, obtain explicit change approval, prepare rollback, apply one narrow config.patch, and determine whether restart is required.","Verify gateway health, Slack streaming behavior, and new warnings or errors before closeout."],"blocked_actions":["Do not change the value based on hearsay.","Do not edit live configuration files directly, apply configuration, or restart services under this request."],"evidence":["The gateway-runtime-safety skill requires schema-first validation and says not to guess configuration field types.","Config writes and service lifecycle actions require explicit approval.","The user prohibited operational tools and changes, so the live schema and configuration were not queried."],"response":"Hold the change until the installed gateway schema confirms the accepted type. The string \"partial\" may be a valid mode rather than an invalid boolean substitute."}