{"skill_used":null,"decision":"hold","actions":["Assessed readiness only; no edit or publication performed."],"blocked_actions":["Do not approve for publication until reference comparison is completed and the required Visual QA marker is present."],"evidence":["The visual has no reference comparison.","The marker “Visual QA: PASS - reference-checked handmade sketchnote” is absent.","Tiny labels may impair LinkedIn readability."],"response":"Not ready. Hold publication pending reference-based visual QA, the required PASS marker, and confirmation that labels are legible at feed size."}