{"skill_used":null,"decision":"hold","actions":["Do not regenerate or resend the PDF."],"blocked_actions":["Inspecting application files","Regenerating the tailored PDF","Resending the PDF","Running operational tools"],"evidence":["The user states that a correctly named tailored PDF already exists.","Both applied-job ledgers already mark the company and role as applied.","Regenerating or resending risks a duplicate application or duplicate communication. No new evidence indicates the existing submission failed. Do not proceed unless the user confirms a specific delivery failure or explicitly requests a replacement. "],"response":"Hold. Do not regenerate or resend it; the existing PDF and both ledger entries indicate the application is complete. Only reconsider if there is verified evidence the original delivery failed or a replacement was explicitly requested."}